"LESQF0801914"	"Lear Electrical Systems de México S. de R.L. de C.V. Planta Zaragoza"	"Equipos y articulos electronicos, electricos y domesticos "	"Produccion de aparatos, equipos y/o accesorios electricos y/o electronicos"	"Producción de arneses automotrices"	0	0	"28°40'20"""	"106°05'48"""	"CHIHUAHUA"	"Chihuahua"	"Av. Zaragoza"	1700		"Av. Tecnológico"	"c. Miguel Barragán"	"Parral"	"Chihuahua"		31140
"LESQF0801915"	"Lear Electrical Systems de México S. de R.L. de C.V. Planta Pino"	"Equipos y articulos electronicos, electricos y domesticos "	"Produccion de aparatos, equipos y/o accesorios electricos y/o electronicos"	"Ensamblado de arneses automotrices"	0	0	28.67123	-106.08908	"CHIHUAHUA"	"Chihuahua"	"Pino"	2703		"Cosmos"	"Av. de las Industrias"	"Satélite"	"Chihuahua"		31170
"LESQF0801917"	"Lear Electrical Systems de México S. de R.L. de C.V. Planta Sicomoro"	"Automotriz "	"Produccion de auto partes troqueladas y estampadas"	"Ensamble de mazos de alambre"	0	0	28.67409	-106.08825	"CHIHUAHUA"	"Chihuahua"	"Sicomoro"	5501		"Av. de las Industrias"	"América Latina"	"Parque Ind. Nombre de Dios"	"Chihuahua"	"Parque Industrial Nombre de Dios"	31110
"LESRP0801911"	"Lear Electrical Systems de México S. de R.L. de C.V. Planta Américas I"	"Automotriz "	"Produccion de auto partes troqueladas y estampadas"	"Fabricación de estampados y troqueles industriales para diferentes usos"	0	0	"28°38'54"""	"-106°7'21"""	"CHIHUAHUA"	"Chihuahua"	"Prol. Av. Américas"	"Edificio 5"		"Av. Washington"	"Perif. de la Juventud"	"Panamericana"	"Chihuahua"	"Parque Industrial Las Américas"	31200
"LESRP0801951"	"Lear Electrical Systems de México S. de R.L. de C.V. Planta Tecnológico"	"Automotriz "	"Produccion de auto partes troqueladas y estampadas"	"Manufactura de arneses automotrices"	0	0	"28°40'18"""	"-106°5'53"""	"CHIHUAHUA"	"Chihuahua"	"Tecnológico"	"SN"		"Zaragoza"	"Sicomoro"	"Parral"	"Chihuahua"		31160
"LFCLR1510911"	"LUZ Y FUERZA DEL CENTRO CENTRAL TERMOELECTRICA ING. JORGE LUQUE L."	"Generacion de energia electrica "	"Generacion y transmision de energia electrica"	"GENERACION DE ENERGIA ELECTRICA (CON GAS NATURAL)"	0	0	"19°37'0"""	"99°11'0"""	"MEXICO"	"Tultitlan"	"CARR. MEXICO CUAUTITLAN KM. 22.5"	"SN"	"SL"			"LECHERIA"	"TULTITLAN"	"LECHERIA"	54590
"LFV5P0900711"	"LABORATORIOS FRU VEU S.A. DE C.V."	"Quimica"	"Produccion de plaguicidas y otros quimicos agricolas"	"PRODUCCIÓN DE PLAGUICIDAS Y OTROS QUÍMICOS AGRÍCOLAS (INCLUYE PRODUCTOS ORGÁNICOS E INORGÁ"	0	0	19.35979	-99.10627	"DISTRITO FEDERAL"	"Iztapalapa"	"CUATRO"	158		"BENITO JUAREZ"	"PREHISPANICOS"	"GRANJAS SAN ANTONIO"	"IZTAPALAPA"		9070
"LGU1S1403912"	"LECHERA GUADALAJARA SA DE CV PLANTA NO. 2"	"Alimenticio y/o de consumo humano "	"Pasteurizacion, deshidratacion, evaporizacion y condensacion de leche"	"PASTEURIZACION ELABORACION CAPTACION Y VENTA DE LECHE Y DERIVADOS ASI COMO DE JUGOS DE FRU"	0	0	20.6368	-103.32995	"JALISCO"	"Guadalajara"	"DR. R. MICHEL"	2885		"RIO CUESTA"	"RIO SAYULA"	"EL ROSARIO"	"GUADAJALARA"	"NA"	44890
"LHI7F1306911"	"LAMINADOS DE HIDALGO S.A. DE C.V."	"Metalurgica (incluye la siderurgica) "	"Laminacion primaria de hierro y acero"	"LAMINACIÓN PRIMARIA DE HIERRO Y ACERO"	0	0	"19°49'35"""	"98°56'24"""	"HIDALGO"	"Tizayuca"	"AVENIDA MEXICO"	"SIN"	"NUM."	"AVENIDA MEXICO"	"16 DE ENERO"	"HUITZILA"	"TIZAYUCA"		43820
"LHOEA1505711"	"LABORATORIOS HORMONA S.A. DE C.V."	"Quimica"	"Produccion de farmaceuticos y medicamentos"	"MANUFACTURA DE PRODUCTOS FARMACEUTICOS"	0	0	"19°25'0"""	"0°0'0"""	"MEXICO"	"Naucalpan de Juarez"	"BOULEVAR MANUEL ÁVILA CAMACHO"	470		"HORMONA"	"AVENIDA PRIMERO DE MAYO"	"SAN ANDRES ATOTO"	"NAUCALPAN"		53500
"LIC1S1403911"	"Liconsa S.A. de C.V. Planta Jalisco"	"Alimenticio y/o de consumo humano "	"Pasteurizacion, deshidratacion, evaporizacion y condensacion de leche"	"Tratamiento Industrial de Leche fesca o en polvo así como de otros productos lácteos"	0	0	"20°40'32"""	"103°23'9"""	"JALISCO"	"Guadalajara"	"Parras"	1668				"Alamo Industrial"	"Guadalajara"		44490
"LIF5T0901511"	"LABORATORIOS IFUSA S.A."	"Quimica"	"Produccion de farmaceuticos y medicamentos"	"PRODUCCIÓN DE FARMACÉUTICOS Y MEDICAMENTOS"	0	0	19.43654	-99.16797	"DISTRITO FEDERAL"	"Cuauhtemoc"	"FRANSISCO LORENZANA"	20		"ANTONIO CASO"	"FRANSISCO DIAZ COBARRUBIAS"	"SAN RAFAEL"			6470
"LIMEA2802211"	"LIFESTREAM INTERNATIONAL DE MEXICO S. DE R.L. DE C.V."	"Quimica"	"Produccion de materias primas para medicamentos"	"PRODUCCIÓN DE FARMACÉUTICOS Y MEDICAMENTOS (NO INCLUYE EMPACADO Y/O ETIQUETADO)."	24	45	"25°53'7"""	"-97°32'38"""	"TAMAULIPAS"	"Matamoros"	"PROLONGACION UNIONES"	94				"UNIONES"	"MATAMOROS"	"PARQUE INDUSTRIAL"	87325
"LIN1A0200311"	"LORIAN INTERNATIONAL S DE RL DE CV"	"Textiles, fibras e hilos "	"Estampado y/o Acabado de Ropa y Productos de otros materiales"	"Confección de artículos y otros materiales textiles naturales y sintéticos"	0	0	"32°32'32"""	"116°40'25"""	"BAJA CALIFORNIA"	"Tecate"	"Km 139 Carretera Mexicali Tijuana"	"SN"				"Rancho La Puerta Paso del Aguila"	"TECATE"	"Periferia de la ciudad de Tecate no es parque industrial"	21501
"LKE5T0900311"	"Laboratorios Kendrick S.A"	"Quimica"	"Produccion de farmaceuticos y medicamentos"	"Producción de farmaceuticos y medicamentos. No incluye empacado yo etiquetado."	0	0	19.31329	-99.14126	"DISTRITO FEDERAL"	"Coyoacan"	"Textitlán"	42		"Tlalpan"	"Tlapacoya"	"Santa Ursula Coapa"			4650
"LLC5E2201611"	"LABORATORIO LITO COLOR S. A. DE C. V."	"Otros"	"Edicion, Encuadernacion y/o impresion"	"IMPRESIÓN Y ACABADO DE REVISTAS FOLLETOS E INSERTOS"	0	0	20.41034	-99.98226	"QUERETARO"	"San Juan del Rio"	"AV. CENTRAL"	235		"AVENIDA CENTRAL"	"AVENIDA CONSTITUYENTES"	"ZONA INDUSTRIAL VALLE DE ORO"	"SAN JUAN DEL RIO"	"ZONA INDUSTRIAL VALLE DE ORO"	76802
"LLI5T0900411"	"LABORATORIOS LIOMONT S.A. DE C.V."	"Quimica"	"Produccion de farmaceuticos y medicamentos"	"PRODUCCIÓN DE FARMACÉUTICOS Y MEDICAMENTOS"	0	0	"19°21'35"""	"99°17'43"""	"DISTRITO FEDERAL"	"Cuajimalpa de Morelos"	"ADOLFO LOPEZ MATEOS"	68		"CASTILLO LEDON"	"JESUS DEL MONTE"	"CUAJIMALPA"			5000
"LME7U2111411"	"LUWA MEXICO S.A. DE C.V."	"Articulos y productos metalicos "	"Produccion de aparatos de refrigeracion y/o aire acondicionado"	"FABRICACION E INSTALACION DE SISTEMAS DE AIRE ACONDICIONADO PARA LA IND. TEXTIL Y CONFORT"	0	0	"19°3'14"""	"98°12'8"""	"PUEBLA"	"Puebla"	"MARTIRES DE RIO BLANCO"	19		"AV. PRINCIPAL LOS CERRITOS"	"CARR. VIA RAPIDO A SANTA ANA CHIAUTEMPAN"	"PARQUE INDUSTRIAL 5 DE MAYO"	"PUEBLA"	"5 DE MAYO"	72019
"LME8A1403911"	"LUIS MEXIN S. A. DE C. V."	"Quimica"	"Galvanoplastia"	"GALVANOPLASTIA (EN PIEZAS METÁLICAS; NO INCLUYE JOYERÍA)."	0	0	20.68962	-103.31893	"JALISCO"	"Guadalajara"	"CERRO AZUL"	1249		"PUERTO MELAQUE"	"SAN IDELFONSO"	"POSTES CUATES"	"GUADALAJARA"		44350
"LME9J0502711"	"LINAMAR DE MEXICO S.A. DE C.V."	"Automotriz "	"Produccion de partes para el sistema de transmision automotriz"	"PRODUCCIÓN DE PARTES PARA EL SISTEMA DE TRANSMISIÓN AUTOMOTRIZ (SI INCLUYE PROCESOS TÉRMIC"	0	0	25.56371	-100.92404	"COAHUILA"	"Ramos Arizpe"	"INDUSTRIA AUTOMOTRIZ"	3070				"N.A."		"PARQUE INDUSTRIAL SALTILLO RAMOS ARIZPE"	25900
"LMEBF0900211"	"LUCTA MEXICANA S.A. DE C.V."	"Quimica"	"Produccion de substancias quimicas a partir de mezclas"	"ELABORACIÓN DE SABORIZANTES Y FRAGANCIAS"	0	0	19.48746	-99.16273	"DISTRITO FEDERAL"	"Azcapotzalco"	"PONIENTE 122"	673		"PONIENTE 116"	"CALZADA AZCAPOTZALCO LA VILLA"	"PUEBLO LAS SALINAS"			2610
"LMEEA0900221"	"Lucta Mexicana S.A. de C.V."	"Alimenticio y/o de consumo humano "	"Produccion de aditivos para alimentos"	"Elaboración de Saborizantes y Fragancias"	0	0	"19°29'9"""	"-99°9'45"""	"DISTRITO FEDERAL"	"Azcapotzalco"	"Poniente 122"	163		"poniente 116"	"Poniente 128"	"Pueblo las Salinas"			2610
"LMI5M1505711"	"LABORATORIOS MIXIM S.A. DE C.V."	"Quimica"	"Produccion de materias primas para medicamentos"	"ELABORACION DE EXTRACTOS BOTANICOS PARA LA INDUSTRIA FARMACEUTICA COSMETICA Y ALIMENTARIA."	0	0	"19°30'47"""	"99°15'51"""	"MEXICO"	"Naucalpan de Juarez"	"JARDIN SUR"	6		"F.C. MEXICO TOLUCA"		"CENTRO"			53000
"LMM7I0901611"	"LAMINADORA MEXICANA DE METALES S.A. de C.V."	"Metalurgica (incluye la siderurgica) "	"Laminacion secundaria de hierro y acero"	"FABRICACIÓN DE TORNILLOS TUERCAS Y REMACHES"	7770	2880	19.44468	-99.20232	"DISTRITO FEDERAL"	"Miguel Hidalgo"	"Lago zurich"	168		"Rió San Joaquin"	"Lago andromaco"	"Ampliación granada"		"Zona Industrial"	11520
"LMTMV0803711"	"Lear Mexicam Trim Operations S.DE R.L de C.V. Planta Juarez."	"Automotriz "	"Confeccion de asientos y accesorios de tela de uso automotriz"	"Corte y confeccion de vestiduras automotrices"	0	0	31.70782	-106.42639	"CHIHUAHUA"	"Juarez"	"Ejercito Nacional"	6525		"Panamericana"	"Valentin Fuentes"	"El Marquez"		"Fuera de Parques"	32530
"LMTMV0803714"	"LEAR MEXICAN TRIM OPERATIONS S. DE R.L. DE C.V."	"Automotriz "	"Confeccion de asientos y accesorios de tela de uso automotriz"	"FABRICACION DE VESTIDURAS AUTOMOTRICES"	0	0	31.67895	-106.42309	"CHIHUAHUA"	"Juarez"	"CARRETERA PANAMERICANA"	5176		"CESAREO SANTOS"	"PARQUE CENTRAL"	"LA CUESTA"	"CD JUAREZ"	"CARRETERA"	32650
"LNFEA0901111"	"LABORATORIO FARMACOLOGICO NUTRIMEDI S.A DE C.V."	"Quimica"	"Produccion de farmaceuticos y medicamentos"	"FABRICACION DE MEDICAMENTOS PARA USO HUMANO"	0	0	"19°13'29"""	"-99°3'36"""	"DISTRITO FEDERAL"	"Tlahuac"	"ADOLFO RIVERA VELADOR"	23		"APOLONIO ARIAS"	"FELIPE LARIOS"	"SANTA CECILIA"			13010
"LOMDA1503711"	"EPIFANIO CARLOS LÓPEZ MARTÍNEZ"	"Alimenticio y/o de consumo humano "	"Incubacion, cria y engorda de animales para consumo alimenticio"	"PORCICULTURA"	0	0	"19°22'45"""	"99°20'52"""	"MEXICO"	"Huixquilucan"	"DOMICILIO CONOCIDO"	"SN"		"NA"	"NA"	"DOS RÍOS"	"DOS RÍOS"		52760
"LPAEA1607911"	"LAMINADORA PATZCUARO S.A. DE C.V."	"Metalurgica (incluye la siderurgica) "	"Fundicion de chatarra de fierro, de aluminio, de bronce, de plomo y de otros materiales metalicos"	"FUNDICION Y LAMINACION DE COBRE Y LATON"	0	0	"19°24'27"""	"101°38'5"""	"MICHOACAN"	"Salvador Escalante"	"YUNQUE"	34		"SIN NOMBRE"	"SIN NOMBRE"	"EL ARTESANO"	"SANTA CLARA DEL COBRE"	"EN LAS AFUERAS DEL POBLADO DE STA CLARA"	61800
"LPD911000711"	"LG PHILIPS DISPLAYS MEXICO S.A. DE C.V."	"Equipos y articulos electronicos, electricos y domesticos "	"Produccion de focos y tubos de iluminacion"	"FABRICACION DE TUBOS DE RAYOS CATODICOS"	0	0	"25°36'13"""	"0.103°26'46"""	"DURANGO"	"Gomez Palacio"	"CARRETERA JABONOSO EL TAJITO"	"KM. 1.5"				"EJIDO CUBA"	"GOMEZ PALACIO"		35078
"LPI5T0900311"	"LABORATORIOS PiSA S.A. DE C.V."	"Quimica"	"Produccion de farmaceuticos y medicamentos"	"PRODUCCIÓN DE FARMACÉUTICOS Y MEDICAMENTOS (NO INCLUYE EMPACADO Y/O ETIQUETADO)."	0	0	19.34445	-99.16822	"DISTRITO FEDERAL"	"Coyoacan"	"MIGUEL ÁNGEL DE QUEVEDO"	555		"ALFA"	"MOCTEZUMA"	"ROMERO DE TERREROS"			4310
"LPI5T1403912"	"Laboratorios PiSA S.A de C.V"	"Quimica"	"Produccion de farmaceuticos y medicamentos"	"PRODUCCIÓN DE FARMACÉUTICOS Y MEDICAMENTOS (NO INCLUYE EMPACADO Y/O ETIQUETADO)."	0	0	20.63613	-103.3679	"JALISCO"	"Guadalajara"	"Calle 7"	1308		"calle 6"	"calle 8"	"zona industrial"	"Guadalajara"	"Zona industrial"	44940
"LPQ9M2201421"	"LINDE PULLMAN DE QUERÉTARO S.A DE C..V"	"Automotriz "	"Produccion de otras auto partes"	"FABRICACIÓN DE PRODUCTOS METAL MECANICOS AUTOMOTRICES"	350917.99	2302277	"0°0'0"""	"0°0'0"""	"QUERETARO"	"Queretaro"	"CARR. QUERÉTRO SAN LUIS POTOSÍ KM 28.5"	25	2	"AV. DE LA NORIA"	"BALDIO"	"PARQUE INDUSTRIAL QUERÉTARO"	"SANTA ROSA JAUREGUI"	"PARQUE INDUSTRIAL QURÉTARO"	76220
"LPU9L2111411"	"LUK PUEBLA S.A. DE C.V."	"Automotriz "	"Produccion de partes para el sistema de frenos automotriz"	"FABRICACIÓN DE EMBRAGUES DISCOS Y PASTAS"	0	0	"19°4'42"""	"98°8'43"""	"PUEBLA"	"Puebla"	"N.D"	2		"Privada Resurrección"	"P y M S.A. de C.V."		"PUEBLA"	"RESURRECCIÓN"	72920
"LSAEA0901411"	"Laboratorios Sanfer S.A. de C.V."	"Quimica"	"Produccion de farmaceuticos y medicamentos"	"Fabricación venta y distribución de productos químico farmacéuticos"	0	0	"19°23'46"""	"-99°8'11"""	"DISTRITO FEDERAL"	"Benito Juarez"	"Calzada de Tlalpan"	550	"NA"	"Antonio Maura"	"Bismarck"	"Moderna"			3510
"LSE5T0901611"	"LABORATORIOS SENOSIAIN S.A. DE C.V."	"Quimica"	"Produccion de farmaceuticos y medicamentos"	"FABRICACIÓN DE MEDICAMENTOS"	0	0	19.4444	-99.18099	"DISTRITO FEDERAL"	"Miguel Hidalgo"	"LAGO SILVERIO"	177	"N.A."	"LAGO BOLSENA"	"LAGUNA DE TÉRMINOS"	"ANAHUAC"	"NA"		11320
"LSE5T1100712"	"LABORATORIOS SENOSIAIN S.A. DE C.V."	"Quimica"	"Produccion de farmaceuticos y medicamentos"	"PRODUCCIÓN DE FARMACÉUTICOS Y MEDICAMENTOS (NO INCLUYE EMPACADO Y/O ETIQUETADO)."	313968.08291	2275669.76367	20.56851	-100.78529	"GUANAJUATO"	"Celaya"	"CAMINO A SAN LUIS REY"	221				"EX HACIENDA STA RITA"	"CELAYA"		38137
"LSEEA1100721"	"LABORATORIOS SENOSIAIN S. A. DE C.V."	"Quimica"	"Produccion de materias primas para medicamentos"	"FABRICACION DE MATERIAS PRIMAS PARA LA ELABORACION DE MEDICAMENTOS"	313968.08291	2275669.76367	"20°34'15"""	"-100°47'5"""	"GUANAJUATO"	"Celaya"	"CAMINO A SAN LUIS REY"	221		"N.A."	"N.A."	"EX HDA. STA. RITA"	"CELAYA"		38137
"LSO5T1403911"	"LABORATORIOS SOPHIA S.A. DE C.V."	"Quimica"	"Produccion de farmaceuticos y medicamentos"	"PRODUCCIÓN DE FARMACÉUTICOS Y MEDICAMENTOS OFTALMICOS"	0	0	20.67754	-103.35376	"JALISCO"	"Guadalajara"	"INDEPENDENCIA"	795		"FEDERALISMO"	"MEZQUITAN"	"CENTRO"	"GUADALAJARA"		44290
"LSOEA1409811"	"LABORATORIOS SOLFRAN S.A"	"Quimica"	"Produccion de materias primas para medicamentos"	"PRODUCCIÓN DE FARMACÉUTICOS Y MEDICAMENTOS (NO INCLUYE EMPACADO Y/O ETIQUETADO)."	673080	2281010	"20°37'30"""	"103°20'15"""	"JALISCO"	"Tlaquepaque"	"Altos Hornos"	2721		"fuelle"	"oleoducto"	"alamo industrial"	"tlaquepaque"	"INDUSTRIAL EL ALAMO"	44490
"LTMRP1512111"	"LACAS Y TINTAS DE MEXICO S.A. DE C.V."	"Pinturas y tintas "	"Produccion de tintas para impresion y escritura"	"FABRICACION DE TINTAS PARA LAS ARTES GRAFICAS"	0	0	"19°30'0"""	"99°7'0"""	"MEXICO"	"Cuautitlan Izcalli"	"ANTOINE LAVOISIER No.23"	23		"AV. CARLOS GONZALEZ CAMARENA"	"GRAHAM BELL"	"PARQUE INDUSTRIAL CUAMATLA"		"PARQUE INDUSTRIAL CUAMATLA"	54730
"LUC8A0901011"	"LUCK S.A DE C.V."	"Quimica"	"Galvanoplastia"	"GALVANOPLASTIA (EN PIEZAS METÁLICAS; NO INCLUYE JOYERÍA)."	0	0	19.35695	-99.2352	"DISTRITO FEDERAL"	"Alvaro Obregon"	"PROLONGACIÓN AVENIDA CENTENARIO"	1306		"BELEN DE LAS FLORES"	"ANGEL REYES"	"PUERTA GRANDE"	"ALVARO OBREGON"		1640
"LUD2F2602911"	"JULIO RAMON LUEBBERT DUARTE"	"Alimenticio y/o de consumo humano "	"Secado, salado y harinas de pescados y mariscos"	"ELABORACION DE HARINA DE PESCADO"	0	0	"27°52'44"""	"110°52'9"""	"SONORA"	"Guaymas"	"LOTE 1 MANZANA C Y D"	"SN"				"PARQUE INDUSTRIAL"	"GUAYMAS"	"RODOLFO SANCHEZ TABOADA"	85485
"LUREA2802711"	"LUREMEX S.A. DE C.V. PLANTA 2"	"Articulos y productos compuestos de diferentes materiales "	"Produccion de articulos y aparatos deportivos"	"FABRICACION DE CARNADAS ARTIFICIALES PARA PESCA"	445000	3042700	"27°30'6"""	"-99°33'24"""	"TAMAULIPAS"	"Nuevo Laredo"	"CALZADA REVOLUCION"	224		"ESTEFANIA CASTAÑEDA"	"E. VILLARREAL"	"BUENAVISTA"	"NUEVO LAREDO"		88120
"LVI6Z1505711"	"LATINOAMERICANA DE VIDRIO S.A. DE C.V."	"vidrio"	"Produccion de botellas, envases y similares de vidrio"	"PRODUCCIÓN DE BOTELLAS, ENVASES Y SIMILARES DE VIDRIO (SÓLO CUANDO SE ELABORA EL VIDRIO; N"	0	0	19.47071	-99.22601	"MEXICO"	"Naucalpan de Juarez"	"GENERAL AGUSTIN MILLAN"	10		"16 DE SEPTIEMBRE"	"PERIFERICO"	"SAN ANDRES ATOTO"	"ESTADO DE MEXICO"	"SAN ANDRES ATOTO"	53000
"LZA5T1412011"	"LABORATORIOS ZAFIRO S.A. DE C.V."	"Quimica"	"Produccion de farmaceuticos y medicamentos"	"PRODUCCIÓN DE FARMACÉUTICOS Y MEDICAMENTOS (NO INCLUYE EMPACADO Y/O ETIQUETADO)."	0	0	20.6263	-103.42911	"JALISCO"	"Zapopan"	"CIRCUNVALACIÓN NORTE"	56		"LA CALMA"	"CIRCUNVALACIÓN SUR"	"LAS FUENTES"	"ZAPOPAN"		45070
"LZE5T0900311"	"LABORATORIOS ZERBONI S.A."	"Quimica"	"Produccion de farmaceuticos y medicamentos"	"PRODUCCIÓN DE FARMACÉUTICOS Y MEDICAMENTOS"	2152750	488450	19.30384	-99.11014	"DISTRITO FEDERAL"	"Coyoacan"	"ANAHUAC"	147		"RANCHO VISTA HERMOSA"	"CALZADA DEL HUESO"	"MIRADOR EXHACIENDA DE COAPA"	"DF"		4950
"MAC9L0803711"	"Morse Automotive Corporation México S de R. L de C.V."	"Automotriz "	"Produccion de partes para el sistema de frenos automotriz"	"PRODUCCIÓN DE PARTES PARA EL SISTEMA DE FRENOS AUTOMOTRIZ (SÓLO MEDIANTE PROCESOS TÉRMICOS"	361628.756	3506863.91	31.69174	-106.45884	"CHIHUAHUA"	"Juarez"	"Magneto"	2035		"Cid"	"Oliver Cronwell"	"Parque Industrial Fernández"	"Cd Juárez"	"Parque Industrial Fernández"	32649
"MAC9M0600211"	"Manufactura Avanzada de Colima S. A. de C. V."	"Automotriz "	"Produccion de otras auto partes"	"Maquiladora de comra-venta de productos eléctricos para la industria automotriz"	638698	2130242	"19°14'36.04"""	"103°43'29.10"""	"COLIMA"	"Colima"	"Blvd. Marcelino García Barragán"	"NA"	1	"Tercer anillo periférico"	"Prolongación tercer anillo Periférico"	"El Diezmo"	"Colima"	"Parte Oriente de la Ciudad"	28000
"MAD301410511"	"LA MADRILEÑA S.A. DE C.V."	"Bebidas y tabaco"	"Produccion de bebidas alcoholicas a base de fermentacion y/o destilacion"	"ELABORACION DE TEQUILA Y AGUARDIENTE"	0	0	"20°32'58"""	"0.102°48'21"""	"JALISCO"	"Tototlan"	"KM 64 CARRETERA GUADALAJARA LA PIEDAD"	"SN"		"NA"	"NA"	"NA"	"TOTOTLAN"		47730
"MAEEA1000511"	"MOTORES Y APARATOS ELECTRICOS DE DURANGO S.A. DE C.V. PLANTA 3"	"Automotriz "	"Produccion de otras auto partes"	"FABRICACION DE MODULOS DE AIRE ACONDICIONADO Y REFACCIONES DE ALUMINIO"	0	0	"24°4'7"""	"-104°36'28"""	"DURANGO"	"Durango"	"2DA DE SELENIO"	"M 4B"	"L4 Y 5"	"ALUMINIO"	"ESTAÑO"	"CIUDAD INDUSTRIAL"	"DURANGO"	"CIUDAD INDUSTRIAL"	34208
"MAERP1000511"	"MOTORES Y APARATOS ELECTRICOS DE DURANGO S.A DE C.V. PLANTA 2"	"Automotriz "	"Produccion de otras auto partes"	"FABRICACION DE MODULOS DE AIRE ACONDICIONADO"	0	0	"24°3'56"""	"-104°36'30"""	"DURANGO"	"Durango"	"ALUMINIO Y SELENIO"	"M4B"	"L4 Y 5"	"ALUMINIO"	"POTASIO"	"CIUDAD INDUSTRIAL"	"DURANGO"	"CIUDAD INDUSTRIAL"	34208
"MAERP1000521"	"MOTORES Y APARATOS ELECTRICOS DE DURANGO S.A. DE C.V. PLANTA 1"	"Automotriz "	"Produccion de otras auto partes"	"FABRICACION DE MODULOS DE AIRE ACONDICIONADO Y REFACCIONES DE ALUMINIO"	0	0	"24°3'58"""	"-104°36'33"""	"DURANGO"	"Durango"	"ALUMINIO Y SELENIO"	"1 A 3 Y 44 A 46"		"SEGUNDA DE SELENIO"	"ESTAÑO"	"CIUDAD INDUSTRIAL"	"DURANGO"	"CIUDAD INDUSTRIAL"	34208
"MAG5I0502711"	"MAGNELEC S.A. DE C.V."	"Quimica"	"Produccion de acidos, bases y sales inorganicas"	"ACONDICIONAMIENTO DE OXIDO DE MAGNESIO PARA USOS INDUSTRIALES"	0	0	"25°30'58"""	"100°57'46"""	"COAHUILA"	"Ramos Arizpe"	"BOULEVARD INDUSTRIAS"	1800					"RAMOS ARIZPE"	"CORREDOR INDUSTRIAL DE RAMOS ARIZPE"	25900
"MAP9M1000711"	"METZELER Automotive Profile Systems Mexico S.A. de C.V."	"Automotriz "	"Produccion de otras auto partes"	"PRODUCCIÓN DE OTRAS AUTOPARTES (SI INCLUYE PROCESOS TÉRMICOS O DE FUNDICIÓN)."	0	0	25.57247	-103.45713	"DURANGO"	"Gomez Palacio"	"Blvd. Gomez Palacio"	265	"N A"	"Lerdo de Tejada"	"Prolongacion Valle del Guadiana"	"3a etapa P.I.L."	"GOMEZ PALACIO"	"Parque Industrial Lagunero"	35070
"MAPEA0900611"	"MAPROSA S. A. DE C. V."	"Quimica"	"Galvanoplastia"	"FABRICA DE ARTICULOS TROQUELADOS EN LAMINA CON GALVANOPLASTIA"	0	0	"19°24'59"""	"-99°4'3"""	"DISTRITO FEDERAL"	"Iztacalco"	"UNO"	295		"UNION"	"TEXCOCO"	"PANTITLAN"		"ZONA HABITACIONAL E INDUSTRIA MEZCLADA"	8100
"MAS9M1100741"	"Meridian Automotive Systems de México. S. de R. L. de C. V."	"Automotriz "	"Produccion de otras auto partes"	"PRODUCCIÓN DE OTRAS AUTOPARTES (SI INCLUYE PROCESOS TÉRMICOS O DE FUNDICIÓN)."	0	0	20.55218	-100.81234	"GUANAJUATO"	"Celaya"	"Avenida México Japón"	400		"Norte 5"	"Avenida México Japón"	"Ciudad Industrial"	"Celaya"	"Ciudad Industrial Celaya"	38010
"MATEA1512011"	"DE MATEO Y COMPAÑIA S.A. DE C.V."	"Quimica"	"Produccion de colorantes y pigmentos"	"PRODUCCIÓN DE COLORANTES Y PIGMENTOS (INCLUYE ORGÁNICOS E INORGÁNICOS, SÓLO CUANDO SE PROD"	0	0	"19°47'40"""	"99°4'26"""	"MEXICO"	"Zumpango"	"Carretera Zumpango Los Reyes Km. 11.5"	"SN"		"Boulevard de las Flores"	"Calle de las Bugambilias"	"Barrio de San Lorenzo"	"Zumpango"		55600
"MAU171303411"	"Compañía Minera Autlán S.A. de C.V."	"Metalurgica (incluye la siderurgica) "	"Mineria de manganeso"	"MINERÍA DE MANGANESO (SÓLO INCLUYE BENEFICIO)."	526850.7	2318756.14	"20°58'4"""	"98°44'37"""	"HIDALGO"	"Lolotla"	"Domicilio conocido"	"S N"					"Ayotetla"	"Predio"	43130
"MAU7F1000712"	"COMPAÑIA MINERA AUTLAN S.A.B. DE C.V PLANTA GOMEZ PALACIO"	"Metalurgica (incluye la siderurgica) "	"Laminacion primaria de hierro y acero"	"LAMINACIÓN PRIMARIA DE HIERRO Y ACERO (INCLUYE FERROALEACIONES, ACEROS COMUNES Y ESPECIALE"	0	0	25.63977	-103.43755	"DURANGO"	"Gomez Palacio"	"KM 9 CARR. GOMEZ PALACIO A FCO I MADERO"	"NA"		"NA"	"NA"	"NA"	"GOMEZ PALACIO"	"PERIFERIA"	35000
"MAUEA2800711"	"MAQUILADORA AUREA S.A DE C.V"	"Articulos y productos metalicos "	"Produccion de joyeria y orfebreria"	"FABRICACION Y MAQUILA DE JOYERIA EN GENERAL"	2314797	3198075	"260°19'20"""	"280°50'2"""	"TAMAULIPAS"	"Camargo"	"CARR. AL PUENTE INTERNACIONAL"	"KM1"		"KM1"		"CUAUHTEMOC"			88440
"MAV970803711"	"Manufacturas Avanzadas S.A. de C.V."	"Equipos y articulos electronicos, electricos y domesticos "	"Produccion de aparatos, equipos y/o accesorios electricos y/o electronicos"	"Ensamble de Televisiones"	0	0	31.60753	-106.37583	"CHIHUAHUA"	"Juarez"	"Boulevard Independencia"	2151				"Parque Industrial Salvarcar"	"Cd Juarez"	"Salvarcar"	32590
"MBA121001911"	"COMPAÑÍA MINERA BASIS S.A. DE C.V."	"Metalurgica (incluye la siderurgica) "	"Mineria de oro"	"EXPLOTACIÓN Y BENEFICIO DE MINERALES DE ORO Y PLATA"	0	0	"24°33'11"""	"105°53'6"""	"DURANGO"	"Otaez"	"N/A"	"N/A"		"N/A"	"N/A"	"N/A"	"N/A"	"LOS PARAJES DE BACIS ZONA DE LAS QUEBRADAS"	34000
"MBA5I1503311"	"Mallinckrodt Baker S.A. de C.V."	"Quimica"	"Produccion de acidos, bases y sales inorganicas"	"FABRICACIÓN Y VENTA DE PRODUCTOS QUÍMICOS BASICOS"	2306487	448967	19.52595	-99.07145	"MEXICO"	"Ecatepec de Morelos"	"Plomo"	2		"Av. Central"	"Av. del Hierro"	"Esfuerzo NacionalL"	"Xalostoc"	"Esfuerzo Nacional Xalostoc"	55320
"MBELM1510411"	"MEXBESTOS S.A. DE C.V."	"Asbesto"	"Autopartes para transportes fabricadas con asbesto"	"AUTOPARTES PARA TRANSPORTES FABRICADOS CON ASBESTO; INCLUYE CLUTCH, FRENOS Y JUNTAS, CUAND"	0	0	19.50414	-99.212	"MEXICO"	"Tlalnepantla de Baz"	"CALZADA DE LAS ARMAS"	150		"GUILLERMO BARROSO"	"SAN AGUSTIN"	"FRACCIONAMIENTO INDUSTRIAL LAS ARMAS"	"ESTADO DE MEXICO"	"FRACCIONAMIENTO INDUSTRIAL LAS ARMAS"	54080
"MBS140800511"	"Minera Bismark S.A de C.V"	"Metalurgica (incluye la siderurgica) "	"Mineria de zinc y plomo"	"Extracción y beneficio de minerales"	253373.5166	3458450.0974	"31°14'14"""	"0.107°35'21"""	"CHIHUAHUA"	"Ascension"	"Av. Arboledas"	"SN"		"NA"	"NA"	"Bismark"	"Ascención"	"Zona Rural"	31821
"MCMEA1403911"	"MOLYCOP MEXICO S.A DE C.V."	"Metalurgica (incluye la siderurgica) "	"Laminacion secundaria de hierro y acero"	"FABRICACION DE BOLAS DE ACERO Y PRODUCTOS SIMILARES"	0	0	"20°38'58"""	"103°20'25"""	"JALISCO"	"Guadalajara"	"RAMAL DEL FERROCARRIL A ZONA INDUSTRIAL"	"501 B"		"LAZARO CARDENAS"	"CAMINO ANTIGUO A LA AVIACION"	"LA NOGALERA"			44440
"MCMEA1509011"	"MANUFACTURERA DE CIGUEÑALES DE MÉXICO S. A DE C. V."	"Automotriz "	"Produccion de partes para el sistema de transmision automotriz"	"PRODUCCIÓN DE PARTES PARA EL SISTEMA DE TRANSMISIÓN AUTOMOTRIZ (SI INCLUYE PROCESOS TÉRMIC"	0	0	"18°39'7"""	"99°31'37"""	"MEXICO"	"Tenango del Valle"	"CARRETERA LA MARQUESA TENANGO KM 38.5"	"NA"		"NA"	"NA"	"NA"	"TENANGO DEL VALLE"		52300
"MCREA0502211"	"MINERA CARBONIFERA RIO ESCONDIDO S.A DE C.V. TAJO III TAJO II EXTENSION"	"Metalurgica (incluye la siderurgica) "	"Extraccion y/o beneficio de minerales no metalicos"	"EXTRACCION DE CARBON MINA A CIELO ABIERTO"	0	0	"28°31'59"""	"100°41'21"""	"COAHUILA"	"Nava"	"CARR. 57 KM 220 TRAMO MONCLOVA P. NEGRA"	"NA"	"NA"	"NA"	"NA"	"NA"	"NAVA"		26170
"MCRRP0502211"	"MINERA CARBONIFERA RIO ESCONDIDO S.A DE C.V. MINA V SUBTERRANEA"	"Metalurgica (incluye la siderurgica) "	"Extraccion y/o beneficio de minerales no metalicos"	"EXTRACCION DE CARBON MINA SUBTERRANEA"	50810344	315337791	"28°30'0"""	"100°40'0"""	"COAHUILA"	"Nava"	"CARR 57 KM 220 TRAMO MONCLOVA P. NEGRAS"	"NA"		"NA"	"NA"	"NA"	"NAVA"		26170
"MCRRP0502221"	"MINERA CARBONIFERA RIO ESCONDIDO S.A. DE C.V. MINA II"	"Metalurgica (incluye la siderurgica) "	"Extraccion y/o beneficio de minerales no metalicos"	"EXTRACCIÓN DE CARBON MINA SUBTERRANEA"	0	0	"28°28'37"""	"100°38'23"""	"COAHUILA"	"Nava"	"CARRETERA 57 KM 220 TRAMO MONCLOVA P. N."	"NA"		"NA"	"NA"	"NA"	"NAVA"		26170
"MCRRP0502231"	"MINERA CARBONIFERA RIO ESCONDIDO PLANTA LAVADORA"	"Metalurgica (incluye la siderurgica) "	"Extraccion y/o beneficio de minerales no metalicos"	"LAVADO Y MEZCLADO DEL CARBON"	0	0	"28°29'23"""	"100°40'13"""	"COAHUILA"	"Nava"	"CARRETERA 57 KM 220 TRAMO MONCLOVA PN."	"NA"		"NA"	"NA"	"NA"	"NAVA"		26170
"MCUMJ1101511"	"COMPAÑIA MINERA DEL CUBO S.A. DE C.V."	"Metalurgica (incluye la siderurgica) "	"Mineria de plata"	"MINERÍA DE PLATA (SÓLO INCLUYE BENEFICIO)."	272752	2323701	"21°1'41"""	"101°15'38"""	"GUANAJUATO"	"Guanajuato"	"DOMICILIO CONOCIDO MINERAL DEL CUBO"	"SN"				"SC"	"MINERAL DEL CUBO"	"COMUNIDAD RURAL"	36250
"MDI4B0803711"	"MANUFACTURAS DIVRSIFICADAS S.A. DE C.V."	"Textiles, fibras e hilos "	"Confeccion de prendas de vestir"	"ENSAMBLE DE ROPA DESECHABLE PARA USO Y-O CONSUMO DE HOSPITAL"	0	0	31.69876	-106.43815	"CHIHUAHUA"	"Juarez"	"AV. VALENTIN FUENTES"	3130		"RAMON RIVERA LARA"	"J.M. RIOS"	"KM. 5"			32625
"MDM9I0100511"	"MOTO DIESEL MEXICANA S.A. DE C.V."	"Automotriz "	"Produccion de motores automotrices a gasolina y diesel"	"FABRICACION DE AUTOPARTES A DIESEL Y GASOLINA-ENSAMBLE DE MOTORES DIESEL"	779011.882	2421730.942	"21°57'0"""	"102°17'12"""	"AGUASCALIENTES"	"Jesus Maria"	"KM. 8.5 CARRETERA FEDERAL No. 45"	"SIN No."				"ZONA INDUSTRIAL NORTE"		"CORREDOR INDUSTRIAL NORTE"	20140
