"DEKMB1506211"	"DEKORMEX S.A. DE C.V."	"Articulos y productos plasticos "	"Fabricacion de productos y articulos de plastico"	"FABRICACION DE PANELES DE ILUMINACION CANCELERIA Y DOMOS"	0	0	"19°16'37"""	"99°28'49"""	"MEXICO"	"Ocoyoacac"	"ACUEDUCTO LERMA"	107		"RIO OCOYOACAC"	"EST. FERR. MACLOVIO HERRERA"	"OCOYOACAC"	"OCOYOACAC"		52740
"DEL5R2800311"	"DYNASOL ELASTÓMEROS S.A. DE C.V."	"Quimica"	"Produccion de hule sintetico"	"Fabricación de Hule Sintetico"	0	0	"22°26'24"""	"0.97°58'6"""	"TAMAULIPAS"	"Altamira"	"Carretera Tampico Mante"	"Km 28.5"		"NA"	"NA"	"NA"	"ALTAMIRA"	"Corredor Industrial Altamira"	89600
"DFEEA0803711"	"Lear Mexican Trim Operations S.R. de C.V. Planta San Lorenzo"	"Automotriz "	"Confeccion de asientos y accesorios de tela de uso automotriz"	"Corte y Confeccion de Vestiduras Automotrices"	0	0	"31°40'3"""	"-106°23'52"""	"CHIHUAHUA"	"Juarez"	"Av. San Lorenzo"	250	"Sur"	"Fray Pedro de Gante"	"Av. Tecnologico"		"CD JUAREZ"	"Beefer"	32320
"DHA9K1510611"	"DANA HEAVY AXLE MEXICO S.A. DE C.V."	"Automotriz "	"Produccion de partes para el sistema de suspension y direccion"	"PRODUCCIÓN DE PARTES PARA EL SISTEMA DE SUSPENSIÓN Y DIRECCIÓN (SI INCLUYE PROCESOS TÉRMIC"	0	0	19.29578	-99.60986	"MEXICO"	"Toluca"	"ALBERTO EINSTEING"	401		"INDUSTRIA QUIMICA"	"INDUSTRIA AUTOMOTRIZ"	"IND AUTOMOTRIZ E IND QUIMICA"	"TOLUCA"	"INDUSTRIAL TOLUCA"	50071
"DIAEA1505111"	"DIACROMEX S.A. DE C.V."	"Quimica"	"Galvanoplastia"	"GALVANOPLASTIA (EN PIEZAS METÁLICAS; NO INCLUYE JOYERÍA)."	0	0	"19°16'37"""	"-99°30'28"""	"MEXICO"	"Lerma"	"CARRETERA MEXICO TOLUCA"	"KM 54.5"		"SIDERURGICA NACIONAL"	"CAMINO REAL"	"DOÑA ROSA"	"LERMA DE VILLADA"		52000
"DIN6D1412011"	"DEPORTIVA INDUSTRIAL S.A. DE C.V."	"Quimica"	"Fabricacion de articulos y productos de hule"	"FABRICACIÓN Y VENTA DE ARTICULOS DE HULE"	0	0	20.72741	-103.38725	"JALISCO"	"Zapopan"	"JESUS GARCIA"	274		"AV. LAURELES"	"PEDRO MORENO"	"NA"	"ZAPOPAN"		45140
"DIS9M2802221"	"Delphi Interior Systems de México S.A. de C.V. Operaciones Componentes Mecanicos"	"Automotriz "	"Produccion de otras auto partes"	"PRODUCCIÓN DE OTRAS AUTOPARTES (SI INCLUYE PROCESOS TÉRMICOS O DE FUNDICIÓN)."	24	45	"25°52'58"""	"97°32'51"""	"TAMAULIPAS"	"Matamoros"	"Avenida Michigan y Prol. Uniones"	"SN"		"Prolongacion Uniones"		"Parque Industrial"		"Parque Industrial"	87310
"DIS9M2802231"	"Delphi Interior Systems de México S.A. de C.V Operaciones RIMIR"	"Automotriz "	"Produccion de otras auto partes"	"PRODUCCIÓN DE OTRAS AUTOPARTES (SI INCLUYE PROCESOS TÉRMICOS O DE FUNDICIÓN)."	0	0	"25°53'24"""	"97°33'45"""	"TAMAULIPAS"	"Matamoros"	"Avenida Michigan"	"SN"		"Ohio"		"Parque Industrial de Norte"	"H Matamoros"	"Parque Industrial del Norte"	87316
"DITRP0503011"	"DITEMSA SA de CV"	"Articulos y productos metalicos "	"Fabricacion de articulos y productos metalicos"	"DISEÑO FABRICACION Y VENTA DE HERRAMNTALES."	0	0	"25°27'0"""	"-100°59'58"""	"COAHUILA"	"Saltillo"	"BOULEVARD LUIS ECHEVERRIA"	1280		"ISIDRO LOPEZ ZERTUCHE"	"BOULEVARD VITO ALESIO ROBLES"	"LA SALLE"	"SALTILLO"		25240
"DJU9M0803712"	"DELMEX DE JUAREZ S. DE R.L. DE C.V. PLANTA II"	"Automotriz "	"Produccion de otras auto partes"	"PRODUCCIÓN DE OTRAS AUTOPARTES (SI INCLUYE PROCESOS TÉRMICOS O DE FUNDICIÓN)."	0	0	31.63041	-106.38825	"CHIHUAHUA"	"Juarez"	"AVENIDA INTERMEX"	1681		"AVENIDA DE LAS TORRES"	"AVENIDA VALLE DEL CEDRO"	"PARQUE IND INTERMEX"	"CIUDAD JUAREZ"	"PARQUE INDUSTRIAL INTERMEX"	32040
"DMAN31610711"	"Derivados Macroquímicos S.A. de C.V."	"Quimica"	"Produccion de substancias quimicas a partir de mezclas"	"Fabricación de productos químicos no tóxicos"	0	0	"19°50'1"""	"101°46'12"""	"MICHOACAN"	"Zacapu"	"Km. 4.5 Carretera Zacapu Puruándiro"	"SN"				"NA"	"Zacapu"	"Parque Industrial Zacapu"	58600
"DME520200111"	"Dialight de México S. de R.L de C.V"	"Equipos y articulos electronicos, electricos y domesticos "	"Produccion de aparatos, equipos y/o accesorios electricos y/o electronicos"	"Manufacturera Fabricación Ensamble Maquila Transformación de comp. electrónicos"	0	0	"31°52'8"""	"0.116°36'15"""	"BAJA CALIFORNIA"	"Ensenada"	"Privada Kino Sur"	"No."	278			"Parque Industrial Misión"	"Ensenada"	"Parque industrial Mision"	22830
"DME581900611"	"DanHil de Mexico .S.A DE C.V."	"Celulosa y papel"	"Fabricacion de articulos y productos de papel y/o carton"	"FABRICACION Y ENSAMBLE DE EMPAQUES (CAJAS) DE CARTON CORRUGADO"	0	0	"25º45'16.01"""	"100º08'18.2"""	"NUEVO LEON"	"Apodaca"	"TECNOLOGIA"	110		"INDUSTRIAS"		"PARQUE IND. LA SILLA APODACA"	"APODACA"	"PARQUE INDUSTRIAL LA SILLA APODACA"	66648
"DME5Q1000511"	"DYNEA MEXICO S.A. DE C.V."	"Quimica"	"Produccion de resinas sinteticas"	"PRODUCCIÓN DE RESINAS SINTÉTICAS (INCLUYE PLASTIFICANTES)."	0	0	24.07927	-104.66687	"DURANGO"	"Durango"	"CARRETERA PANAMERICANA KM 959 INTERIOR"	"SN"				"POB JOSE MARIA MORELOS Y PAVON"	"DURANGO"	"MASISA DE MEXICO"	34304
"DME8V1900611"	"DENSO MEXICO S.A. DE C.V."	"Automotriz "	"Produccion de otras auto partes"	"FABRICACION DE PARTES AUTOMOTRICES"	2850925.832	383377.304	"25º46'18"""	"100º09'46"""	"NUEVO LEON"	"Apodaca"	"BOULEVARD PARQUE INDUSTRIAL MONTERREY"	502		"CUARTA PONIENTE"	"QUINTA PONIENTE"	"PARQUE INDUSTRIAL MONTERREY"	"APODACA"	"PARQUE INDUSTRIAL MONTERREY"	66600
"DME910200111"	"Dialight de México S. de R.L de C.V"	"Equipos y articulos electronicos, electricos y domesticos "	"Produccion de aparatos, equipos y/o accesorios electricos y/o electronicos"	"Fabricación Manufacturera y distribución de la Industria Electrica y Electrónica"	0	0	"31°53'21"""	"0.116°41'29"""	"BAJA CALIFORNIA"	"Ensenada"	"Colinas de Riverside"	"No"	120			"Colinas del Mar El Sauzal"	"Ensenada"	"Colinas de Riverside"	22880
"DME9G0503011"	"DaimlerChrysler de México SA de CV Complejo Saltillo"	"Automotriz "	"Produccion de automoviles, camiones, tractocamiones y similares"	"PRODUCCIÓN DE AUTOMÓVILES Y CAMIONES (INCLUYE TRACTOCAMIONES Y SIMILARES)."	0	0	"25°16'30"""	"100°8'30"""	"COAHUILA"	"Saltillo"	"Km 1.5 Carretera a Derramadero"	"Sin Numero"					"Saltillo"	"Parque Industrial Santa Fé"	25000
"DMEEA2804111"	"Datacom de mexico S.A de C.V."	"Equipos y articulos electronicos, electricos y domesticos "	"Produccion de equipo de computo y sus perifericos"	"Fabricacion ensamble y reparacion de maquinas de oficina"	2375346	3166043	"26°1'7"""	"98°13'59"""	"TAMAULIPAS"	"Victoria"	"brecha E 99"	"SN"				"parque industrial"	"reynosa"	"parque industrial reynosa"	88980
"DMEND1501311"	"DIECASTING MEXICANA S.A DE C.V"	"Metalurgica (incluye la siderurgica) "	"Fundicion y moldeo de piezas de metales no ferrosos"	"FABRICACION DE PIEZAS DE ALUMINIO POR INYECCION A PRESION"	0	0	"19°34'9"""	"99°15'52"""	"MEXICO"	"Atizapan de Zaragoza"	"ALFREDO DEL MAZO"	9		"CIRCUITO GUSTAVO BAZ"	"CERRADA ALFREDO DEL MAZO"	"FRACCIONAMIENTO INDUSTRIAL EL PEDREGAL"	"CIUDAD LOPEZ MATEOS"	"INDUSTRIAL EL PEDREGAL"	52948
"DMEND1512111"	"NEW DYNACAST DE MÉXICO S.A. DE C.V."	"Metalurgica (incluye la siderurgica) "	"Fundicion y moldeo de piezas de metales no ferrosos"	"FUNDICIÓN Y MOLDEO DE PIEZAS DE METALES NO FERROSOS."	0	0	19.6558	-99.19164	"MEXICO"	"Cuautitlan"	"AV. TRANSFORMACIÓN"	19				"FFRACC. INDUSTRIAL LA JOYA"	"CUAUTITLÁN IZCALLI"	"LA JOYA"	54730
"DMERP1510611"	"DaimlerChrysler de México S.A. de C.V."	"Automotriz "	"Produccion de automoviles, camiones, tractocamiones y similares"	"Ensamble de Autos"	0	0	"19°8'44"""	"99°34'41"""	"MEXICO"	"Toluca"	"Km 60.5 Carretera México Toluca"	"SN"		"Albert Einstein"	"San Jerónimo"		"Toluca"	"Corredor Industrial Toluca Lerma"	50000
"DMO5U1903911"	"DERIVADOS METAL ORGANICOS SA DE CV"	"Pinturas y tintas "	"Produccion de pinturas, recubrimientos e impermeabilizantes"	"PRODUCCIÓN DE TODO TIPO DE PINTURAS, RECUBRIMIENTOS E IMPERMEABILIZANTES (EXCLUYE PRODUCTO"	0	0	"25º42'27.61"""	"100º16'39.99"""	"NUEVO LEON"	"Monterrey"	"AVE. LOS ANGELES 3408 OTE"	3408		"FELIX U. GOMEZ"	"ANTONIO I. VILLARREAL"	"COYOACAN"	"MONTERREY"		64510
"DNPMB1407011"	"DSM Nutritional Products México S.A. de C.V."	"Quimica"	"Produccion de substancias quimicas a partir de mezclas"	"FABRICACIÓN DE PREMEZCLAS DE VITAMINAS Y MINERALES PARA NUTRICIÓN Y SALUD HUMANA Y ANIMAL"	685162	2266954	"20°29'32"""	"103°13'28"""	"JALISCO"	"El Salto"	"CARRETERA GUADALAJARA EL SALTO KM 22.5"	"NA"	"NA"	"NA"	"NA"	"NA"	"EL SALTO"	"CORREDOR INDUSTRIAL"	45680
"DSE9L0502711"	"DELPHI SISTEMAS DE ENERGIA S.A. DE C.V."	"Automotriz "	"Produccion de partes para el sistema de frenos automotriz"	"PRODUCCIÓN DE PARTES PARA EL SISTEMA DE FRENOS AUTOMOTRIZ"	0	0	"25°29'47"""	"100°58'59"""	"COAHUILA"	"Ramos Arizpe"	"CARR. SALTILLO PIEDRAS NEGRAS KM. 8.54"	"KM 8.54"		"NA"	"NA"	"NA"	"RAMOS ARIZPE"	"PARQUE INDUSTRIAL"	25900
"DSE9M0503511"	"Delphi Sistemas de Energía S.A. de C.V. Planta 59"	"Automotriz "	"Produccion de otras auto partes"	"Ensamble de piezas automotrices"	2825631.348	664302.505	25.53965	-103.36537	"COAHUILA"	"Torreon"	"Calle Alamedas"	750		"Av. Juarez"	"Av. Allende"	"Fraccionamiento Las Arboledas"	"Torreón"		27077
"DSI9U0803711"	"DAVOL SURGICAL INNOVATIONS S.A. DE C.V."	"Articulos y productos compuestos de diferentes materiales "	"Produccion de equipos y/o articulos, medicos y/o quirurgicos"	"ENSAMBLE Y EMPAQUETADO DE PRODUCTOS MEDICOS QUIRURGICOS"	3500989	364470	31.63546	-106.44587	"CHIHUAHUA"	"Juarez"	"AVE. GENERAL ROBERTO FIERRO"	6408		"BLVD. OSCAR FLORES"	"CARRETERA PANAMERICANA"	"P. IND. AEROPUERTO"	"JUAREZ"	"PARQUE INDUSTRIAL AEROPUERTO"	32369
"DSM5G2803211"	"DOWELL SCHLUMBERGER DE MEXICO S.A. DE C.V."	"Otros"	"Reparacion y mantenimiento de maquinaria y equipo pesado"	"SERVICIOS A LA INDUSTRIA PETROLERA"	0	0	"26°1'50"""	"98°25'9"""	"TAMAULIPAS"	"Reynosa"	"AUTOPISTA REYNOSA MONTERREY KM. 199"	"SN"		"NA"	"NA"	"NA"	"REYNOSA"	"BASE OPERATIVA REYNOSA"	88500
"DSMC42700411"	"Dowell Schlumberger de Mexico S.A. de C.V."	"Otros"	"Reparacion y mantenimiento de maquinaria y equipo pesado"	"Servicios a la Industria Petrolera"	0	0	"17°59'0"""	"92°18'0"""	"TABASCO"	"Centro"	"Carretera Villahermosa Cardenas Km. 7"	"NA"				"Rancheria Lazaro Cardenas"			86260
"DULEA1512121"	"DULCIPAN S.A. DE C.V."	"Alimenticio y/o de consumo humano "	"Panaderias"	"ELABORACION Y VENTA DE PAN EMPACADO"	0	0	"19°54'24"""	"99°39'7"""	"MEXICO"	"Cuautitlan Izcalli"	"ANTONIO E. LAVOISIER"	"1 Y 3"		"CALZADA DE GUADALUPE"	"GUILLERMO GONZALEZ CAMARENA"	"PARQUE IND. CUAMATLA"	"ESTADO DE MEXICO"	"PARQUE INDUSTRIAL CUAMATLA"	54730
"DUP5S1901911"	"DUPEK S. DE R.L. DE C.V."	"Quimica"	"Produccion de fibras y filamentos sinteticos y artificiales"	"Fabricación de toda clase de fibras sinteticas artificiales celulositas o de cualquier otr"	0	0	"25º40'25.53"""	"100º24'45.14"""	"NUEVO LEON"	"San Pedro Garza Garcia"	"Boulevard Díaz Ordaz Km 333"	"Km 333"				"La Leona"		"AKRA NYLMEX"	66210
"DVC9G1510111"	"DAIMLERCHRYSLER VEHICULOS COMERCIALES MEXICO, S.A. DE C.V."	"Automotriz "	"Produccion de automoviles, camiones, tractocamiones y similares"	"PRODUCCIÓN DE AUTOMÓVILES Y CAMIONES (INCLUYE TRACTOCAMIONES Y SIMILARES)."	0	0	"19°11'0"""	"99°28'0"""	"MEXICO"	"Tianguistenco"	"Km. 23.7 carretera la Marquesa a Tenango"	0				"Santiago Tianguistenco"	"Santiago Tianguistenco"	"Santiago Tianguistenco"	52600
"EAG360100111"	"Embotelladora Aguascalientes S.A. de C.V."	"Bebidas y tabaco"	"Produccion de refrescos"	"Elaboración y venta de refrescos y otras bebidas no alcoholicas"	0	0	21.81557	-102.28556	"AGUASCALIENTES"	"Aguascalientes"	"Camino a San Bartolo"	100		"Carretera Panamericana"	"Ejido Cotorina"	"Coyotes Sur"	"Aguascalientes"		20394
"EAG360100112"	"Embotelladora Aguascalientes S.A. de C.V Planta CEDIS Las Trojes"	"Bebidas y tabaco"	"Produccion de refrescos"	"ELABORACION Y VENTA DE BEBIDAS CARBONATADAS NO ALCOHOLICAS"	0	0	21.93775	-102.29321	"AGUASCALIENTES"	"Aguascalientes"	"AVE. NIÑOS HEROES"	200		"BOULEVARD A ZACATECAS"	"AVE. INDEPENDENCIA"	"TROJES DE ALONSO"	"AGUASCALIENTES"	"SALIDA A ZACATECAS"	20110
"EAL7I2402811"	"ESTIRADORA DE ALAMBRES S.A."	"Metalurgica (incluye la siderurgica) "	"Laminacion secundaria de hierro y acero"	"ESTIRAJE EN FRIO DE ALAMBRE PARA LA FABRICACION DE ALAMBRE PULIDO Y ALAMBRE RECOCIDO"	0	0	"22°7'24"""	"0.1°55'7"""	"SAN LUIS POTOSI"	"San Luis Potosi"	"CARRETERA CENTRAL KM. 419.5"	"SN"		"ESQUINA PERIFERICO ORIENTE"		"ZONA INDUSTRIAL"	"SAN LUIS POTOSI"	"ZONA INDUSTRIAL"	78395
"EAM360100111"	"ENVASADORAS DE AGUAS EN MEXICO S. DE R.L. DE C.V."	"Bebidas y tabaco"	"Envasado de aguas purificadas o de manantial"	"ENVASADO DE AGUA NATURAL PURIFICADA."	0	0	"21°56'15"""	"0.1°17'24"""	"AGUASCALIENTES"	"Aguascalientes"	"BOULEVARD A ZACATECAS"	"KM4.5"		"NIÑOS HEROES"	"3 ANILLO"	"TROJES DE ALONSO"	"AGUASCALIENTES"	"CORREDOR INDUSTRIAL Y O DE SERVICIOS"	20320
"EAUEA1501411"	"ENFRIAMIENTO DE AUTOMOVILES S.A. DE C.V."	"Quimica"	"Fabricacion de articulos y productos de hule"	"PRODUCCION DE ARTICULOS DE HULE"	0	0	"19°48'11"""	"-99°52'44"""	"MEXICO"	"Atlacomulco"	"CALLE No. 17"	17	"SN"	"NA"	"NA"		"ATLACOMULCO"	"PARQUE INDUSTRIAL ATLACOMULCO"	50450
"EAVAD1103311"	"ENERGIA AZTECA VIII S. DE R.L. DE C.V."	"Generacion de energia electrica "	"Generacion y transmision de energia electrica"	"GENERACIÓN Y TRANSMISIÓN DE ENERGÍA ELÉCTRICA (SÓLO GENERACIÓN; INCLUYE LAS INSTALACIONES"	0	0	"21°14'47"""	"100°36'32"""	"GUANAJUATO"	"San Luis de la Paz"	"CARR. FEDERAL No 57 KM 82.7 TRAMO QRO SL"	"NA"	"NA"	"NA"	"NA"	"NA"	"SAN LUIS DE LA PAZ"	"PREDIO LOS CERRITOS LAS DELICIAS"	37900
"EAXLS0200211"	"Energia Azteca X S. de R. L. de C. V."	"Otros"	"Plantas de tratamiento de aguas residuales"	"Tratamiento de aguas residuales"	0	0	"32°36'20"""	"115°37'35"""	"BAJA CALIFORNIA"	"Mexicali"	"Km 2 Carretera Fed No 2 Mexicali Tijuana"	"Lote 31"				"Zaragoza"	"Progreso"		21610
"EAXLS0200212"	"Energía Azteca X S. de R. L. de C. V."	"Generacion de energia electrica "	"Generacion y transmision de energia electrica"	"Generación Transmisión y Suministro de Energía Eléctrica"	0	0	32.59648	-115.63009	"BAJA CALIFORNIA"	"Mexicali"	"Km 12 Carretera Fed. 2 Mexicali Tijuana"	"Lote 45"				"Progreso"	"Mexicali"		21610
"EBCAD0200211"	"Energia de Baja California S. de R. L. de C. V"	"Generacion de energia electrica "	"Generacion y transmision de energia electrica"	"GENERACIÓN Y TRANSMISIÓN DE ENERGÍA ELÉCTRICA (SÓLO GENERACIÓN; INCLUYE LAS INSTALACIONES"	0	0	32.59587	-115.63031	"BAJA CALIFORNIA"	"Mexicali"	"Km 12 Carretera Fed.2 Mexicali Tijuana"	"Lote 46"				"Progreso"			21610
"ECC421701111"	"ECCACIV S.A. DE C.V."	"Otros"	"Suministro de servicios de luz, agua, tratamiento de aguas, drenaje ,carga y descarga y ot"	"TRATAMIENTO DE AGUAS RESIDUALES INDUSTRIALES Y MUNICIPALES"	0	0	"18°52'0"""	"99°10'25"""	"MORELOS"	"Jiutepec"	"CARRETERA JIUTEPEC ZAPATA KM. 3.5"	"NA"		"CALERA CHICA"	"CAMPO DE FUTBOL DE LA CALERA CHICA"	"MIGUEL HIDALGO"	"JIUTEPEC"		62550
"ECC5U1904611"	"ESMALTES Y COLORANTES COVER S.A. DE C.V."	"Pinturas y tintas "	"Produccion de pinturas, recubrimientos e impermeabilizantes"	"PRODUCCIÓN DE TODO TIPO DE PINTURAS, RECUBRIMIENTOS E IMPERMEABILIZANTES (EXCLUYE PRODUCTO"	105	100	"25º43'25.39"""	"100º16'46.11"""	"NUEVO LEON"	"San Nicolas de los Garza"	"VIA MONTERREY MATAMOROS"	601				"LOS MORALES"	"SAN NICOLAS"		66480
"ECL8Z2903111"	"Empresas Ca Le de Tlaxcala. S.A. de C.V."	"Metalurgica (incluye la siderurgica) "	"Produccion de acumuladores y pilas electricas"	"Fabricacion y Venta de Acumuladores Automotrices"	2410321	2443813	"19°29'40"""	"98°30'59"""	"TLAXCALA"	"Tetla de la Solidaridad"	"Manzana 2 Seccion C"	"manzana"	2			"Xicohtencatl"		"Cuidad Industrial Xicohtencatl 1"	90434
"ECM910803711"	"Electro Componentes de México S.A. de C.V. Planta 1"	"Equipos y articulos electronicos, electricos y domesticos "	"Produccion de aparatos, equipos y/o accesorios electricos y/o electronicos"	"Fabricación de arneses electrónicos para línea blanca"	0	0	31.69737	-106.45002	"CHIHUAHUA"	"Juarez"	"Chimeneas"	5035				"Parque Industrial Juárez"	"Cd Juárez"	"Parque Industrial Juárez"	32630
"ECO460503211"	"ENSAMBLES DE COAHUILA S.A. DE C.V."	"Textiles, fibras e hilos "	"Confeccion de prendas de vestir"	"CONFECCION DE ROPA EXTERIOR PARA CABALLERO HECHA EN SERIE."	0	0	27.93891	-101.21253	"COAHUILA"	"San Juan de Sabinas"	"ORIZABA"	2346		"5 DE FEBRERO"	"SIN NOMBRE"	"INDEPENDENCIA"	"NUEVA ROSITA"		26830
"ECO9J2201411"	"ENGRANES CONICOS S.A. DE C.V."	"Automotriz "	"Produccion de partes para el sistema de transmision automotriz"	"PRODUCCIÓN DE PARTES PARA EL SISTEMA DE TRANSMISIÓN AUTOMOTRIZ (SI INCLUYE PROCESOS TÉRMIC"	0	0	20.62748	-100.43414	"QUERETARO"	"Queretaro"	"ACCESO III"	7		"PROL. BLV. BERNARDO QUINTANA"	"ACCESO IV"	"FRACC. IND. BENITO JUAREZ"	"QUERETARO"	"FRACC. IND. BENITO JUAREZ"	76120
"ECOB80900211"	"ECOLOMOVIL S.A. DE C.V."	"Otros"	"Recoleccion y transporte de residuos no peligrosos"	"RECOLECCION DE RESIDUOS SOLIDOS NO PELIGROSOS POR MEDIO DE CONTENEDORES"	0	0	"19°27'23"""	"99°13'19"""	"DISTRITO FEDERAL"	"Azcapotzalco"	"AV. HIDALGO"	122	0	"ROSARIO"	"AV. DE LAS GRANJAS"	"SANTA CATARINA"			2250
"ECOEA2803211"	"EATON CONTROLS S. DE R. L. DE C. V."	"Equipos y articulos electronicos, electricos y domesticos "	"Produccion de aparatos, equipos y/o accesorios electricos y/o electronicos"	"PRODUCCION DE ACCESORIOS ELECTRICOS"	0	0	"29°59'42"""	"98°11'48"""	"TAMAULIPAS"	"Reynosa"	"AV. CHAPULTEPEC"	"SN"				"PARQUE INDUSTRIAL COLONIAL"	"REYNOSA"	"PARQUE INDUSTRIAL COLONIAL"	88570
"ECTLK1403911"	"EMERSON CLIMATE TECHNOLOGIES MEXICO S.A DE .V"	"Metalurgica (incluye la siderurgica) "	"Fabricacion y ensamble de maquinaria y equipo para diversos usos industriales"	"FABRICACIÓN Y ENSAMBLE DE MAQUINARIA Y EQUIPO PARA DIVERSOS USOS INDUSTRIALES, CUANDO INCL"	0	0	20.6184	-103.34308	"JALISCO"	"Guadalajara"	"CALZADA GOBERNADOR CURIEL"	3573		"ARTES PLASTICAS"	"ACADEMIA"	"EL MANANTIAL"	"GUADALAJARA"		44970
"ECTLK1403912"	"EMERSON CLIMATE TECHNOLOGIES MEXICO S.A DE C.V."	"Articulos y productos metalicos "	"Produccion de aparatos de refrigeracion y/o aire acondicionado"	"FABRICACION DE COMPONENTES PARA REFRIGERACION Y AIRE ACONDICIONADO"	0	0	20.65249	-103.35211	"JALISCO"	"Guadalajara"	"GANSO"	"85 Y 157"		"GOBERNADOR CURIEL"	"HEROES FERROCARRILEROS"	"LA AURORA"	"GUADALAJARA"		44460
"ECUEA0901711"	"EMPAQUES DE CARTON UNITED S.A. DE C.V. PLANTA CAJAS"	"Celulosa y papel"	"Produccion de carton y cartoncillo"	"CAJA CORRUGADA Y FIBRA SOLIDA"	0	0	"19°27'0"""	"-99°7'14"""	"DISTRITO FEDERAL"	"Venustiano Carranza"	"ETZATLAN"	"25A"		"ALUMINIO"	"CANAL DEL NORTE"	"POPULAR RASTRO"			15220
"ECUEA0901721"	"EMPAQUES DE CARTON UNITED S.A. DE C.V."	"Celulosa y papel"	"Produccion de carton y cartoncillo"	"FABRICACIÓN DE CARTON"	0	0	"19°27'2"""	"-99°7'11"""	"DISTRITO FEDERAL"	"Venustiano Carranza"	"ALUMINIO"	196	196	"COALCOMAN"	"ETZATLAN"	"RASTRO POPULAR"		"RASTRO POPULAR"	15220
"ECVMQ2804111"	"Embotelladora Ciudad Victoria S.A. de C.V."	"Bebidas y tabaco"	"Envasado de aguas purificadas o de manantial"	"PRODUCCIÓN Y VENTA DE BEBIDAS CARBONATADAS"	487686.412	2626801.887	23.75097	-99.12111	"TAMAULIPAS"	"Victoria"	"AVENIDA NUEVO SANTANDER"	1200		"ESQUINA CON BOULEVARD LA PAZ"		"ND"	"CIUDAD VICTORIA"		87089
"EDIMV0803711"	"EXPORTACIONES DIAZ S.A. PLANTA II"	"Automotriz "	"Confeccion de asientos y accesorios de tela de uso automotriz"	"SUBENSAMBLE AUTOMOTRIZ PARA INTERIORES"	3509176	362524	31.73596	-106.46913	"CHIHUAHUA"	"Juarez"	"JOSE BORUNDA"	1835		"HONDURAS"	"COLOMBIA"	"PARTIDO ROMERO"			32030
"EDM910803711"	"Electronica Dale de Mexico S.A de C.V. Planta Bravos"	"Equipos y articulos electronicos, electricos y domesticos "	"Produccion de aparatos, equipos y/o accesorios electricos y/o electronicos"	"Manufacturas de Componentes Electronicos"	0	0	31.62472	-106.39185	"CHIHUAHUA"	"Juarez"	"Avenida de las Torres"	1950		"Ramon Rayon"		"Torres del Sur"	"Ciuda Juarez"		32500
"EDU1M1000511"	"EMPACADORA DURANGOS. DE R.L. DE C.V."	"Alimenticio y/o de consumo humano "	"Matanza de ganado y aves"	"RASTRO"	0	0	"24°1'26"""	"104°34'12"""	"DURANGO"	"Durango"	"POBLADO 15 DE OCTUBRE"	"SN"		"CRISTOBAL COLON"	"DOLORES HIDALGO"	"RANCHO LA SANMARTINA"	"DURANGO"	"CARRETERA PANAMERICANA KM 945"	34217
"EEM580708911"	"ENVASES Y EMPAQUES DE MEXICO SA DE CV"	"Celulosa y papel"	"Fabricacion de articulos y productos de papel y/o carton"	"FABRICACION DE CAJAS CORRUGADAS"	0	0	"14°52'54"""	"92°16'51"""	"CHIAPAS"	"Tapachula"	"KM 1.2 CARRETERA TAPACHULA PUERTO MADERO"	"SN"		"JOAQUIN DEL PINO"	"CARRETERA DEL PUERTO"	"JOAQUIN DEL PINO"	"TAPACHULA"		30790
"EEMEA2201411"	"ENVASES Y EMPAQUES DE MEXICO S.A. DE C.V."	"Celulosa y papel"	"Produccion de carton y cartoncillo"	"FABRICACION DE CAJAS DE CARTON CORRUGADO"	79	53	"20°36'31"""	"-100°23'55"""	"QUERETARO"	"Queretaro"	"EPIGMENIO GONZALEZ"	100		"MIGUEL CABRERA"	"MIGUEL DE CERVANTES"	"LOS MOLINOS"	"SANTIAGO DE QUERETARO"	"FRACCIONAMIENTO INDUSTRIAL LOS MOLINOS"	76150
"EES9U0803711"	"EES S.A. DE C.V."	"Articulos y productos compuestos de diferentes materiales "	"Produccion de equipos y/o articulos, medicos y/o quirurgicos"	"ENSAMBLE Y REPARACIÓN DE INSTRUMENTOS QUIRURGICOS."	0	0	31.64623	-106.39017	"CHIHUAHUA"	"Juarez"	"Av. de las Torres # 7125"	7125		"Blvd.. Zaragoza"		"Salvarcar"	"Cd Juárez"	"Area Industrial en Ciudad Juarez"	32580
"EFREA0803711"	"EMPACADORA Y FRIGORIFICO RODEO S.A.DE C.V."	"Alimenticio y/o de consumo humano "	"Corte y empacado de carnes"	"MATANZA DE GANADO-ABARROTES ELABORACION DE HIELO Y ENVASADO DE AGUA PURIFICADA."	3511122	359865	"31°43'37"""	"106°28'45"""	"CHIHUAHUA"	"Juarez"	"C. BETA"	2898		"C.J.M. PORRAS"	"J.M. JAURRIETA"	"INDUSTRIAL"	"CIUDAD JUAREZ"		32060
"EGU361000511"	"EMBOTELLADORA GUADIANA S. A DE C.V"	"Bebidas y tabaco"	"Produccion de refrescos"	"INDUSTRIA DE LAS BEBIDAS NO ALCOHOLICAS"	0	0	"23°59'37"""	"104°37'38"""	"DURANGO"	"Durango"	"CARRETERA DURANGO MEZQUITAL KM. 3.0"	"SIN NUMERO"		"NA"	"NA"	"NA"	"DURANGO"		34199
"EHE6G2603011"	"ESSEX DE HERMOSILLO S. A. DE C. V."	"Quimica"	"Produccion de adhesivos y selladores"	"FABRICACION DE SELLADORES AUTOMOTRICES"	0	0	"29°1'38"""	"0.11°55'1"""	"SONORA"	"Hermosillo"	"COMETAS"	24		"ESQUINA CON SATELITES"		"PARQUE INDUSTRIAL"	"HERMOSILLO"	"PARQUE INDUSTRIAL HERMOSILLO"	83290
"EIAEA0803741"	"ENSAMBLE DE INTERIORES AUTOMOTRICES, S. DE R.L. DE C.V"	"Automotriz "	"Confeccion de asientos y accesorios de tela de uso automotriz"	"ENSAMBLE DE VESTIDURAS AUTOMOTRICES"	0	0	"31°37'28"""	"106°20'46"""	"CHIHUAHUA"	"Juarez"	"PUERTO DE PALOS 1080"	1080		"SANTO TOMAS"	"BOULEVARD INDEPENDENCIA"	"PATRIA"	"CIUDAD JUAREZ CHIHUAHUA"		32580
"EIAMV0803712"	"Ensamble de Interiores Automotrices S. de R.L. de C.V."	"Automotriz "	"Confeccion de asientos y accesorios de tela de uso automotriz"	"Manufactura de Vestiduras Automotrices"	0	0	31.69192	-106.43689	"CHIHUAHUA"	"Juarez"	"Boulevard Oscar Flores Sanchez"	4250		"Sierra Madre del Sur"	"Avenida Teófilo Borunda"	"Acacias"	"Ciudad Juarez"	"Colonia Acacias"	32360
"EIAMV0803713"	"Ensamble de Interiores Automotrices S. de R.L. de C.V. Planta II"	"Automotriz "	"Confeccion de asientos y accesorios de tela de uso automotriz"	"Ensamble de Vestiduras Automotrices"	0	0	31.68093	-106.44245	"CHIHUAHUA"	"Juarez"	"Cerrada Industrial"	5540		"Eje vial Juan Gabriel"	"Luis Arciniega"	"Parque Industrial Gema II"	"Ciudad Juarez"	"Parque Industrial Gema II"	32648
"EILEA1403911"	"ARMANDO ESPINOSA LEDESMA"	"Tratamiento de residuos peligrosos "	"Tratamiento de residuos biologico-infecciosos"	"TRATAMIENTO DE RESIDUOS BIOLÓGICO-INFECCIOSOS."	2682860	671400	"20°37'54"""	"-103°21'25"""	"JALISCO"	"Guadalajara"	"PRIVADA 22"	2703	"F"	"CALLE 22"	"CALLE 24"	"ZONA INDUSTRIAL"	"GUADALAJARA"	"ZONA INDUSTRIAL GUADALAJARA"	44940
"EIN912803221"	"Eaton Industries S.de R.L. de C.V."	"Articulos y productos metalicos "	"Produccion de valvulas metalicas"	"Ensamble de Diferenciales Válvulas y Espejos"	2876455.055	579001.753	"26°0'23"""	"98°12'38"""	"TAMAULIPAS"	"Reynosa"	"Brecha E99"	"ND"				"Parque Industrial Reynosa"		"Parque Industrial Reynosa"	88780
"EIQMB1510411"	"ESPECIALIDADES INDUSTRIALES Y QUIMICAS S.A. DE C.V."	"Quimica"	"Produccion de resinas sinteticas"	"PRODUCCION DE COMPUESTOS DE PVC Y PLASTIFICANTES"	0	0	19.54592	-99.20513	"MEXICO"	"Tlalnepantla de Baz"	"MANUEL RIVERA"	21		"GUSTAVO BAZ"	"FULTON"	"SAN NICOLAS"	"TLALNEPANTLA"	"SAN NICOLAS"	54030
"EJU5Y0803711"	"EPSON DE JUAREZ S.A. DE C.V. PLANTA 1"	"Pinturas y tintas "	"Produccion de tintas para impresion y escritura"	"PRODUCCIÓN DE TINTAS PARA IMPRESIÓN Y ESCRITURA."	0	0	31.66641	-106.34525	"CHIHUAHUA"	"Juarez"	"Enrico Fermi"	1451	"NA"	"Calle Miguel Catalan"	"Lote Baldio"	"NA"	"JUAREZ"	"Parque Industrial Rio Bravo"	32550
"EJU910803721"	"ELCOTEC JUAREZ, S.A. DE C.V."	"Equipos y articulos electronicos, electricos y domesticos "	"Produccion de aparatos, equipos y/o accesorios electricos y/o electronicos"	"Producción de aparatos de comunicación por cable, radio televisiones y teléfonos"	368458.78	3501892.3	31.64805	-106.38634	"CHIHUAHUA"	"Juarez"	"Boulevard Zaragoza"	1650	"A"	"Henequen"	"Ave. las Torres"	"Desarrollo Industrial Salvarcar"	"Cd Juarez"	"Parque Industrial Salvarcar"	32599
"ELA8T1900611"	"EMERSON LAMINACIONES DE ACERO DE MONTERREY S. A. DE C. V."	"Equipos y articulos electronicos, electricos y domesticos "	"Produccion de motores electricos"	"TROQUELADO DE LAMINA PARA MOTORES ELECTRICOS"	0	0	"25º46'8"""	"100º10'2"""	"NUEVO LEON"	"Apodaca"	"CALLE SEXTA"	"506 PTE."		"AVE. PARQUE INDUSTRIAL"			"APODACA"	"PARQUE INDUSTRIAL MONTERREY"	66600
"ELCRP2201611"	"ELECTRÓNICA CLARION S.A DE C.V"	"Equipos y articulos electronicos, electricos y domesticos "	"Produccion de aparatos, equipos y/o accesorios electricos y/o electronicos"	"ENASMBLE DE PARTES ELECTRONICAS"	398021	2257850	"82°12'38"""	"5°30'41"""	"QUERETARO"	"San Juan del Rio"	"AVENIDA 3 Y ESQUINA CALLE 9"	"NA"	"NA"			"ZONA INDUSTRIAL"	"QUERETARO"	"ZONA INDUSTRIAL"	76802
